{
  "schema_id": "cockpit.replacement.o8.phase-a-packet.v1",
  "outcome": "O8",
  "phase": "A",
  "linear_issue": "CSL-220",
  "maturity": "researched",
  "completion_gate_status": "pending_outcome_artifact",
  "not_claimed": [
    "human_decided",
    "contract_frozen",
    "prototyped",
    "implemented",
    "provider_free_verified",
    "demo_or_paper_qualified",
    "shadow_qualified",
    "limited_live_qualified",
    "release_qualified",
    "PASS",
    "qualification"
  ],
  "source_commit": "ebbaa34489f171e079834d02098135711e1d4755",
  "registry_baseline": "73ab78d9d69494c757cec875855121b1d29320a4",
  "per_pr_benchmark_gating": false,
  "new_ci_cadence": false,
  "research": {
    "parallel_search_ids": [
      "search_8afa65003c515c3b57197de5f5cd25c4",
      "search_902e146c8a56d6e091750abdb2b9d763",
      "search_b6290caf1f31d7a8a710db6b71f76c7e",
      "search_86967d451c3ce6e3c60de7a6868def47",
      "search_4b647f1aa2547fad5b4062554a71c354",
      "search_41e4072e4bc070139371640730ea2eb3"
    ],
    "cited_urls": [
      "https://learn.microsoft.com/en-us/azure/architecture/patterns/strangler-fig",
      "https://pyperf.readthedocs.io/en/stable/run_benchmark.html",
      "https://pyperf.readthedocs.io/en/latest/analyze.html",
      "https://github.com/psf/pyperf",
      "https://enersys.co.th/en/insights/strangler-fig-migration-python-to-rust-2026",
      "https://adaptive-enforcement-lab.com/patterns/architecture/strangler-fig/migration-guide/",
      "https://martinfowler.com/bliki/ParallelChange.html",
      "https://asv.readthedocs.io/en/stable/writing_benchmarks.html",
      "https://asv.readthedocs.io/en/stable/using.html",
      "https://github.com/sharkdp/hyperfine"
    ],
    "retrieved_on": "2026-10-17",
    "retrieved_by": "embedded Parallel results run on Dan's box"
  },
  "disposition": [
    {
      "component_id": "risk-engine",
      "disposition": "retain",
      "paths": [
        "app/risk/"
      ],
      "compatibility": "Pure deterministic checks stay the order-path floor. A faster candidate may not change financial semantics or add I/O or a model call.",
      "evidence": [
        {
          "class": "locally_observed",
          "locator": "app/risk/__init__.py",
          "statement": "The risk package states that it is pure functions, with no LLM, and is the order-path gate."
        },
        {
          "class": "locally_observed",
          "locator": "app/tests/test_invariants.py",
          "statement": "test_invariant_5_risk_engine_has_no_llm guards the no-LLM-in-risk rule."
        },
        {
          "class": "source_documented_fact",
          "locator": "CLAUDE.md",
          "statement": "Invariant 5 requires risk/ to stay free of LLM calls, I/O, and subprocesses."
        }
      ]
    },
    {
      "component_id": "order-gateway",
      "disposition": "retain",
      "paths": [
        "app/brokers/gateway.py"
      ],
      "compatibility": "An order still reaches a broker only through risk, mode, approval, and OrderGateway. The migration facade is not a second order path.",
      "evidence": [
        {
          "class": "locally_observed",
          "locator": "app/brokers/gateway.py",
          "statement": "class OrderGateway is the broker submission boundary."
        },
        {
          "class": "source_documented_fact",
          "locator": "CLAUDE.md",
          "statement": "Invariant 1 requires the single risk, mode, approval, OrderGateway path, including human-initiated trades."
        }
      ]
    },
    {
      "component_id": "audit-ledger",
      "disposition": "retain",
      "paths": [
        "app/storage/audit.py"
      ],
      "compatibility": "The hash-chained append-only audit stays in tests. A benchmark result does not replace chain verification.",
      "evidence": [
        {
          "class": "locally_observed",
          "locator": "app/storage/audit.py",
          "statement": "The ledger is a hash-chained, HMAC-keyed, append-only log with a monotonic sequence."
        },
        {
          "class": "locally_observed",
          "locator": "app/tests/storage/test_audit.py",
          "statement": "Audit chain tests cover the ledger independently of the hot-path timer."
        }
      ]
    },
    {
      "component_id": "fail-closed-breakers",
      "disposition": "retain",
      "paths": [
        "app/orchestrator/breakers.py"
      ],
      "compatibility": "Vendor-limit, stale-data, and hung-orchestrator paths stay watch_only. A faster candidate may not trade without fresh analysis.",
      "evidence": [
        {
          "class": "locally_observed",
          "locator": "app/orchestrator/breakers.py",
          "statement": "Watch-only degradation disables the order path and queues events."
        },
        {
          "class": "source_documented_fact",
          "locator": "CLAUDE.md",
          "statement": "Invariant 7 fails closed to watch_only on vendor limit, stale data, or a hung orchestrator."
        }
      ]
    },
    {
      "component_id": "secrets-store",
      "disposition": "retain",
      "paths": [
        "app/core/secrets.py"
      ],
      "compatibility": "Secrets stay in the OS credential store. This packet does not add a credential.",
      "evidence": [
        {
          "class": "locally_observed",
          "locator": "app/core/secrets.py",
          "statement": "The wrapper reads the OS credential store and redacts values until reveal()."
        },
        {
          "class": "locally_observed",
          "locator": "app/tests/test_invariants.py",
          "statement": "test_invariant_4_no_plaintext_secrets_in_app_or_operator_tools greps the tree."
        }
      ]
    },
    {
      "component_id": "raw-versus-summary-split",
      "disposition": "retain",
      "paths": [
        "app/filings/raw_store.py"
      ],
      "compatibility": "Raw bytes stay separate from summaries and remain the replay anchor. The module docstring's retired invariant number is not the floor id.",
      "evidence": [
        {
          "class": "locally_observed",
          "locator": "app/filings/raw_store.py",
          "statement": "RawStore writes raw filing bytes once, reads them back byte-identical, and does not place them in a derived table."
        },
        {
          "class": "source_documented_fact",
          "locator": "CLAUDE.md",
          "statement": "Invariant 8 stores raw inputs separately from summaries."
        }
      ]
    },
    {
      "component_id": "tier1-hot-path-tripwire",
      "disposition": "retain",
      "paths": [
        "app/benchmarks/cases.py",
        "app/benchmarks/compare.py",
        ".github/workflows/ci.yml"
      ],
      "compatibility": "Keep the existing five-case tripwire, including its relative-IQR rule and exit 0. It is not a pull-request gate and it is not CSL-42 evidence.",
      "evidence": [
        {
          "class": "locally_observed",
          "locator": "app/benchmarks/cases.py",
          "statement": "CASE_NAMES lists risk_evaluate, order_tuple_hash, schema_validate_proposal, outbound_scrub, and audit_append_verify."
        },
        {
          "class": "locally_observed",
          "locator": "app/benchmarks/compare.py",
          "statement": "A case regresses only when median slowdown minus sample spread stays above the threshold, and the process still exits 0."
        },
        {
          "class": "locally_observed",
          "locator": ".github/workflows/ci.yml",
          "statement": "The benchmarks job uses threshold 0.10, five rounds, and two orderings, and does not fail linux-gates."
        }
      ]
    },
    {
      "component_id": "raw-store-implementation",
      "disposition": "measure",
      "paths": [
        "app/filings/raw_store.py"
      ],
      "compatibility": "Store throughput is unmeasured. A later replacement has to keep write-once raw bytes and the hash bind.",
      "evidence": [
        {
          "class": "locally_observed",
          "locator": "app/filings/raw_store.py",
          "statement": "The store hashes, persists, and re-hashes raw bytes. No tier-2 ingest measurement is recorded in this packet."
        },
        {
          "class": "inference",
          "locator": "docs/replacement/SCOPE-AUDIT.md",
          "statement": "The scope audit treats raw storage as reusable evidence machinery, not as a measured replacement boundary."
        }
      ]
    },
    {
      "component_id": "equity-ingest",
      "disposition": "measure",
      "paths": [
        "app/ingest/"
      ],
      "compatibility": "Current feeds are stock-centric untrusted input. No multi-market envelope is selected here.",
      "evidence": [
        {
          "class": "locally_observed",
          "locator": "app/ingest/__init__.py",
          "statement": "The package wires Alpaca news, Finnhub, calendars, EDGAR brew, and FINRA short interest."
        },
        {
          "class": "source_documented_fact",
          "locator": "docs/replacement/SCOPE-AUDIT.md",
          "statement": "The audit calls ingestion partial and stock-centric, with no accepted multi-market evidence envelope."
        }
      ]
    },
    {
      "component_id": "point-in-time-replay",
      "disposition": "measure",
      "paths": [
        "app/quant/feed/synthetic.py",
        "app/tests/system/test_paper_replay.py"
      ],
      "compatibility": "Replay stays point-in-time. A faster replay may not rebuild the past from later data.",
      "evidence": [
        {
          "class": "locally_observed",
          "locator": "app/quant/feed/synthetic.py",
          "statement": "The synthetic feed carries a point-in-time ordering rule."
        },
        {
          "class": "locally_observed",
          "locator": "app/tests/system/test_paper_replay.py",
          "statement": "A paper replay test exists. This packet does not record a matched replay measurement."
        }
      ]
    },
    {